{
    "schema_version": "incident.v1",
    "method": "incident-synthesis.v1",
    "status": "EVALUATED",
    "overview_limit": 7,
    "total_count": 2,
    "omitted_count": 0,
    "items": [
        {
            "id": "incident-d25ccbc6d29c68c7adcccd00deb22fb8fc9bfb3d9749796ed066549da4b04f84",
            "rank": 1,
            "in_overview": true,
            "priority": "HIGH",
            "priority_key": {
                "tier": 1,
                "finding_count": 2,
                "first_epoch_ms": 1767225610000
            },
            "title": "Нарушение SLA: транзакция create-payment в окне steady",
            "summary": "В окне steady нарушено правил policy: 2. Область: транзакция create-payment.",
            "scope": {
                "kind": "transaction",
                "label": "create-payment"
            },
            "window_id": "steady",
            "interval_basis": "WINDOW",
            "interval": {
                "from_epoch_ms": 1767225610000,
                "to_epoch_ms": 1767225640000
            },
            "grouping": {
                "rule": "incident-grouping.v1",
                "key": {
                    "family": "TRANSACTION",
                    "window_id": "steady",
                    "scope": {
                        "kind": "transaction",
                        "label": "create-payment"
                    },
                    "cluster_from_epoch_ms": null
                }
            },
            "finding_count": 2,
            "finding_types": [
                "policy_failure"
            ],
            "finding_ids": [
                "pf-err",
                "pf-p95"
            ],
            "evidence_ids": [
                "pc-err",
                "pc-p95"
            ],
            "refs_truncated": false,
            "negative_evidence": [
                {
                    "check": "OTHER_POLICY_CHECKS_PASSED",
                    "outcome": "NOT_CONFIRMED",
                    "text": "Остальные проверки policy в окне steady выполнены: 1.",
                    "evidence_ids": [
                        "pc-ok-1"
                    ]
                },
                {
                    "check": "RESOURCE_DATA_NOT_PROVIDED",
                    "outcome": "NOT_EVALUATED",
                    "reason_code": "RESOURCE_SNAPSHOT_NOT_PROVIDED",
                    "text": "Снимок ресурсов не передан: ресурсные проверки не выполнялись.",
                    "evidence_ids": []
                }
            ],
            "next_checks": [
                {
                    "check": "COMPARE_WITH_BASELINE",
                    "text": "Сравнить метрики транзакции create-payment с baseline.",
                    "evidence_ids": [
                        "pc-err"
                    ]
                },
                {
                    "check": "PROVIDE_RESOURCE_SNAPSHOT",
                    "text": "Передать снимок ресурсов, чтобы проверить ресурсные сигналы на том же интервале.",
                    "evidence_ids": []
                }
            ],
            "coincident_with": []
        },
        {
            "id": "incident-7d8de8343db202503e4a6b67da3f5469111f00b49c8cad2b15bc2ded64a49118",
            "rank": 2,
            "in_overview": true,
            "priority": "HIGH",
            "priority_key": {
                "tier": 1,
                "finding_count": 1,
                "first_epoch_ms": 1767225610000
            },
            "title": "Нарушение SLA: транзакция search в окне steady",
            "summary": "В окне steady нарушено правил policy: 1. Область: транзакция search.",
            "scope": {
                "kind": "transaction",
                "label": "search"
            },
            "window_id": "steady",
            "interval_basis": "WINDOW",
            "interval": {
                "from_epoch_ms": 1767225610000,
                "to_epoch_ms": 1767225640000
            },
            "grouping": {
                "rule": "incident-grouping.v1",
                "key": {
                    "family": "TRANSACTION",
                    "window_id": "steady",
                    "scope": {
                        "kind": "transaction",
                        "label": "search"
                    },
                    "cluster_from_epoch_ms": null
                }
            },
            "finding_count": 1,
            "finding_types": [
                "policy_failure"
            ],
            "finding_ids": [
                "pf-other"
            ],
            "evidence_ids": [
                "pc-other"
            ],
            "refs_truncated": false,
            "negative_evidence": [
                {
                    "check": "OTHER_POLICY_CHECKS_PASSED",
                    "outcome": "NOT_CONFIRMED",
                    "text": "Остальные проверки policy в окне steady выполнены: 1.",
                    "evidence_ids": [
                        "pc-ok-1"
                    ]
                },
                {
                    "check": "RESOURCE_DATA_NOT_PROVIDED",
                    "outcome": "NOT_EVALUATED",
                    "reason_code": "RESOURCE_SNAPSHOT_NOT_PROVIDED",
                    "text": "Снимок ресурсов не передан: ресурсные проверки не выполнялись.",
                    "evidence_ids": []
                }
            ],
            "next_checks": [
                {
                    "check": "COMPARE_WITH_BASELINE",
                    "text": "Сравнить метрики транзакции search с baseline.",
                    "evidence_ids": [
                        "pc-other"
                    ]
                },
                {
                    "check": "PROVIDE_RESOURCE_SNAPSHOT",
                    "text": "Передать снимок ресурсов, чтобы проверить ресурсные сигналы на том же интервале.",
                    "evidence_ids": []
                }
            ],
            "coincident_with": []
        }
    ]
}
