{
  "schema_version": "incident.v1",
  "method": "incident-synthesis.v1",
  "status": "EVALUATED",
  "overview_limit": 7,
  "total_count": 1,
  "omitted_count": 0,
  "items": [
    {
      "id": "incident-e758b2773bea88cc70cd4b0bdfd79c9868a75be0b068734a4a05ee44dc58c81c",
      "rank": 1,
      "in_overview": true,
      "priority": "HIGH",
      "priority_key": {
        "tier": 1,
        "finding_count": 1,
        "first_epoch_ms": null
      },
      "title": "Нарушение SLA: весь прогон",
      "summary": "За весь прогон нарушено правил policy: 1. Область: весь прогон. Время нарушения не определено.",
      "scope": {
        "kind": "overall"
      },
      "window_id": null,
      "interval_basis": "UNKNOWN",
      "interval": null,
      "grouping": {
        "rule": "incident-grouping.v1",
        "key": {
          "family": "TRANSACTION",
          "window_id": null,
          "scope": {
            "kind": "overall"
          },
          "cluster_from_epoch_ms": null
        }
      },
      "finding_count": 1,
      "finding_types": [
        "policy_failure"
      ],
      "finding_ids": [
        "policy-failure-window-69262186fe735dee"
      ],
      "evidence_ids": [
        "metric-summary-overall",
        "policy-check-window-8c86022b8f05d374"
      ],
      "refs_truncated": false,
      "negative_evidence": [
        {
          "check": "OTHER_POLICY_CHECKS_PASSED",
          "outcome": "NOT_CONFIRMED",
          "text": "Остальные проверки policy выполнены: 2.",
          "evidence_ids": [
            "policy-check-2c53ad68a63670dc",
            "policy-check-ce7affb79a700128"
          ]
        },
        {
          "check": "RESOURCE_DATA_NOT_PROVIDED",
          "outcome": "NOT_EVALUATED",
          "text": "Снимок ресурсов не передан: ресурсные проверки не выполнялись.",
          "evidence_ids": [],
          "reason_code": "RESOURCE_SNAPSHOT_NOT_PROVIDED"
        }
      ],
      "next_checks": [
        {
          "check": "COMPARE_WITH_BASELINE",
          "text": "Сравнить метрики всего прогона с baseline.",
          "evidence_ids": [
            "metric-summary-overall"
          ]
        },
        {
          "check": "PROVIDE_RESOURCE_SNAPSHOT",
          "text": "Передать снимок ресурсов, чтобы проверить ресурсные сигналы на том же интервале.",
          "evidence_ids": []
        }
      ],
      "coincident_with": []
    }
  ]
}
