{
  "schema_version": "incident.v1",
  "method": "incident-synthesis.v1",
  "status": "EVALUATED",
  "overview_limit": 7,
  "total_count": 1,
  "omitted_count": 0,
  "items": [
    {
      "id": "incident-28d0feb239c90079d1e31e29aceaa2c2e89cf52b6f63c87e6423e27e4833038b",
      "rank": 1,
      "in_overview": true,
      "priority": "MEDIUM",
      "priority_key": {
        "tier": 3,
        "finding_count": 1,
        "first_epoch_ms": 1767225620000
      },
      "title": "Сигналы ресурса: host-a в окне steady",
      "summary": "На интервале совпали по времени находки по сущности host-a: 1.",
      "scope": {
        "kind": "entity",
        "entity": "host-a"
      },
      "window_id": "steady",
      "interval_basis": "FINDINGS",
      "interval": {
        "from_epoch_ms": 1767225620000,
        "to_epoch_ms": 1767225640000
      },
      "grouping": {
        "rule": "incident-grouping.v1",
        "key": {
          "family": "RESOURCE",
          "window_id": "steady",
          "scope": {
            "kind": "entity",
            "entity": "host-a"
          },
          "cluster_from_epoch_ms": 1767225620000
        }
      },
      "finding_count": 1,
      "finding_types": [
        "resource_threshold_violation"
      ],
      "finding_ids": [
        "resource-threshold-finding-81ccb2f86183c46d"
      ],
      "evidence_ids": [
        "resource-policy-check-a077d5dd1dce8e12"
      ],
      "refs_truncated": false,
      "negative_evidence": [
        {
          "check": "POLICY_NOT_EVALUATED",
          "outcome": "NOT_EVALUATED",
          "reason_code": "RUN_DEGRADED",
          "text": "Правила policy по транзакциям не проверялись: файл нагрузки разобран не полностью.",
          "evidence_ids": []
        },
        {
          "check": "NO_ANOMALY_EPISODES",
          "outcome": "NOT_CONFIRMED",
          "text": "Эпизоды отклонения от reference-окна по сущности host-a не найдены.",
          "evidence_ids": [
            "anomaly-check-ae8ba35e096aa844"
          ]
        }
      ],
      "next_checks": [
        {
          "check": "OPEN_RESOURCE_SERIES",
          "text": "Открыть ряды сущности host-a за интервал находок.",
          "evidence_ids": [
            "resource-policy-check-a077d5dd1dce8e12"
          ]
        }
      ],
      "coincident_with": []
    }
  ]
}
